{
  "$schema": "../schemas/setup-acceptance-vectors.schema.json",
  "$comment": "Generated by node contract/tools/generate.mjs. Edit contract/tools, not these files.",
  "family": "setup-acceptance",
  "contract": 3,
  "section": "9.7",
  "reference": "tools/document-rules.mjs",
  "notes": [
    "input.text is the document as a client reads it; it is checked as UTF-8 bytes. errors and warnings are sorted, unique codes from section 9.7. Warnings are only reported for a document without errors.",
    "Order: section 12 first, where a refused text is the error schema under every intake and keep is false; then a repeated member name on the canonical text, reported alone; then, for local intake, the identity; then the schema and the rules.",
    "keep is valid for peer and local intake. For applied intake it is true unless section 12 refuses the text.",
    "assignsIdentity is true for local intake when the document has no controller block or a block whose id is absent or null; the document is then checked with a fresh setup id, revision 1 and an empty lineage.",
    "Cases tagged agent-enforced are refused by agent 3.1.0 on config set as well. The base document is the tower setup with setup id setup-3f9c2a71-8d04-4e6b-9a53-7c21b0e5d846."
  ],
  "groups": {
    "documents": [
      {
        "name": "duplicate-member",
        "purpose": "A system that writes agent twice. Parsers disagree about which copy counts, so the document means different things on different devices; this is checked first, on the text, and no other rule is reported.",
        "consumers": [
          "agent",
          "mac",
          "desktop",
          "android"
        ],
        "tags": [
          "agent-enforced"
        ],
        "input": {
          "intake": "peer",
          "text": "{\n  \"version\": 1,\n  \"controller\": {\n    \"id\": \"setup-3f9c2a71-8d04-4e6b-9a53-7c21b0e5d846\",\n    \"revision\": 3,\n    \"lineage\": []\n  },\n  \"machines\": [\n    {\n      \"id\": \"tower\",\n      \"name\": \"Tower\",\n      \"endpoints\": [\n        {\n          \"id\": \"lan\",\n          \"kind\": \"lan\",\n          \"host\": \"desk-tower.local\",\n          \"user\": \"me\",\n          \"port\": 22\n        }\n      ],\n      \"systems\": [\n        {\n          \"id\": \"linux\",\n          \"name\": \"Linux\",\n          \"platform\": \"linux\",\n          \"shell\": \"posix\",\n          \"agent\": [\"/usr/bin/node\", \"/home/me/other.mjs\"],\n          \"agent\": [\n            \"/usr/bin/node\",\n            \"/home/me/.legion-control/bin/launcher.mjs\"\n          ]\n        }\n      ]\n    }\n  ]\n}\n"
        },
        "expect": {
          "valid": false,
          "errors": [
            "duplicate-member"
          ],
          "warnings": [],
          "assignsIdentity": false,
          "keep": false
        }
      },
      {
        "name": "duplicate-machine",
        "purpose": "Two machines share the id tower, so a route, a record and a binding naming it are ambiguous.",
        "consumers": [
          "agent",
          "mac",
          "desktop",
          "android"
        ],
        "tags": [
          "agent-enforced"
        ],
        "input": {
          "intake": "peer",
          "text": "{\n  \"version\": 1,\n  \"controller\": {\n    \"id\": \"setup-3f9c2a71-8d04-4e6b-9a53-7c21b0e5d846\",\n    \"revision\": 3,\n    \"lineage\": []\n  },\n  \"machines\": [\n    {\n      \"id\": \"tower\",\n      \"name\": \"Tower\",\n      \"endpoints\": [\n        {\n          \"id\": \"lan\",\n          \"kind\": \"lan\",\n          \"host\": \"desk-tower.local\",\n          \"user\": \"me\",\n          \"port\": 22\n        }\n      ],\n      \"systems\": [\n        {\n          \"id\": \"linux\",\n          \"name\": \"Linux\",\n          \"platform\": \"linux\",\n          \"shell\": \"posix\",\n          \"agent\": [\n            \"/usr/bin/node\",\n            \"/home/me/.legion-control/bin/launcher.mjs\"\n          ]\n        }\n      ]\n    },\n    {\n      \"id\": \"tower\",\n      \"name\": \"Second tower\",\n      \"endpoints\": [\n        {\n          \"id\": \"lan\",\n          \"kind\": \"lan\",\n          \"host\": \"desk-tower.local\",\n          \"user\": \"me\",\n          \"port\": 22\n        }\n      ],\n      \"systems\": [\n        {\n          \"id\": \"linux\",\n          \"name\": \"Linux\",\n          \"platform\": \"linux\",\n          \"shell\": \"posix\",\n          \"agent\": [\n            \"/usr/bin/node\",\n            \"/home/me/.legion-control/bin/launcher.mjs\"\n          ]\n        }\n      ]\n    }\n  ]\n}\n"
        },
        "expect": {
          "valid": false,
          "errors": [
            "duplicate-machine"
          ],
          "warnings": [],
          "assignsIdentity": false,
          "keep": false
        }
      },
      {
        "name": "duplicate-site",
        "purpose": "Two sites share the id home.",
        "consumers": [
          "agent",
          "mac",
          "desktop",
          "android"
        ],
        "tags": [
          "agent-enforced"
        ],
        "input": {
          "intake": "peer",
          "text": "{\n  \"version\": 1,\n  \"controller\": {\n    \"id\": \"setup-3f9c2a71-8d04-4e6b-9a53-7c21b0e5d846\",\n    \"revision\": 3,\n    \"lineage\": []\n  },\n  \"machines\": [\n    {\n      \"id\": \"tower\",\n      \"name\": \"Tower\",\n      \"endpoints\": [\n        {\n          \"id\": \"lan\",\n          \"kind\": \"lan\",\n          \"host\": \"desk-tower.local\",\n          \"user\": \"me\",\n          \"port\": 22\n        }\n      ],\n      \"systems\": [\n        {\n          \"id\": \"linux\",\n          \"name\": \"Linux\",\n          \"platform\": \"linux\",\n          \"shell\": \"posix\",\n          \"agent\": [\n            \"/usr/bin/node\",\n            \"/home/me/.legion-control/bin/launcher.mjs\"\n          ]\n        }\n      ]\n    }\n  ],\n  \"sites\": [\n    {\n      \"id\": \"home\",\n      \"name\": \"Home\"\n    },\n    {\n      \"id\": \"home\",\n      \"name\": \"Also home\"\n    }\n  ]\n}\n"
        },
        "expect": {
          "valid": false,
          "errors": [
            "duplicate-site"
          ],
          "warnings": [],
          "assignsIdentity": false,
          "keep": false
        }
      },
      {
        "name": "duplicate-system",
        "purpose": "Two systems of one machine share the id linux.",
        "consumers": [
          "agent",
          "mac",
          "desktop",
          "android"
        ],
        "tags": [
          "agent-enforced"
        ],
        "input": {
          "intake": "peer",
          "text": "{\n  \"version\": 1,\n  \"controller\": {\n    \"id\": \"setup-3f9c2a71-8d04-4e6b-9a53-7c21b0e5d846\",\n    \"revision\": 3,\n    \"lineage\": []\n  },\n  \"machines\": [\n    {\n      \"id\": \"tower\",\n      \"name\": \"Tower\",\n      \"endpoints\": [\n        {\n          \"id\": \"lan\",\n          \"kind\": \"lan\",\n          \"host\": \"desk-tower.local\",\n          \"user\": \"me\",\n          \"port\": 22\n        }\n      ],\n      \"systems\": [\n        {\n          \"id\": \"linux\",\n          \"name\": \"Linux\",\n          \"platform\": \"linux\",\n          \"shell\": \"posix\",\n          \"agent\": [\n            \"/usr/bin/node\",\n            \"/home/me/.legion-control/bin/launcher.mjs\"\n          ]\n        },\n        {\n          \"id\": \"linux\",\n          \"name\": \"Linux again\"\n        }\n      ]\n    }\n  ]\n}\n"
        },
        "expect": {
          "valid": false,
          "errors": [
            "duplicate-system"
          ],
          "warnings": [],
          "assignsIdentity": false,
          "keep": false
        }
      },
      {
        "name": "duplicate-endpoint",
        "purpose": "Two endpoints of one machine share the id lan, so a remembered route is ambiguous.",
        "consumers": [
          "agent",
          "mac",
          "desktop",
          "android"
        ],
        "tags": [
          "agent-enforced"
        ],
        "input": {
          "intake": "peer",
          "text": "{\n  \"version\": 1,\n  \"controller\": {\n    \"id\": \"setup-3f9c2a71-8d04-4e6b-9a53-7c21b0e5d846\",\n    \"revision\": 3,\n    \"lineage\": []\n  },\n  \"machines\": [\n    {\n      \"id\": \"tower\",\n      \"name\": \"Tower\",\n      \"endpoints\": [\n        {\n          \"id\": \"lan\",\n          \"kind\": \"lan\",\n          \"host\": \"desk-tower.local\",\n          \"user\": \"me\",\n          \"port\": 22\n        },\n        {\n          \"id\": \"lan\",\n          \"kind\": \"lan\",\n          \"host\": \"192.0.2.20\",\n          \"user\": \"me\"\n        }\n      ],\n      \"systems\": [\n        {\n          \"id\": \"linux\",\n          \"name\": \"Linux\",\n          \"platform\": \"linux\",\n          \"shell\": \"posix\",\n          \"agent\": [\n            \"/usr/bin/node\",\n            \"/home/me/.legion-control/bin/launcher.mjs\"\n          ]\n        }\n      ]\n    }\n  ]\n}\n"
        },
        "expect": {
          "valid": false,
          "errors": [
            "duplicate-endpoint"
          ],
          "warnings": [],
          "assignsIdentity": false,
          "keep": false
        }
      },
      {
        "name": "unknown-site",
        "purpose": "A machine names a site that sites[] does not define (fixture controller-document.invalid-unknown-site.json).",
        "consumers": [
          "agent",
          "mac",
          "desktop",
          "android"
        ],
        "tags": [
          "agent-enforced"
        ],
        "input": {
          "intake": "peer",